{
  "contract_version": 2,
  "defense_id": "honeyval-local",
  "defense_version": "1.21.1",
  "source": {
    "repository_url": "https://github.com/WHS4-RUBY/ruby",
    "revision": "workspace-20260908",
    "source_digest": "sha256:6d985e2934bbabadc4245836913a61052fb552a5aa6fa102d5bda802eefe51f8",
    "license": "Project-internal",
    "paper": null
  },
  "implementation_fidelity": "reduced-emulation",
  "attachment_contracts": [
    {
      "profile": "inline-http",
      "lifecycle_contract_digest": "sha256:9fd122365e4e505d36f4e054a3ef86dc91df29be25e43caa3295f559c1e6cba1",
      "executor_profile": "inline-enforcer"
    }
  ],
  "capabilities": [
    "attack-detection",
    "response-transform"
  ],
  "omitted_components": [
    "The benchmark registers the current reverse proxy attachment only; paper-level equivalence is not claimed."
  ],
  "paper_claim_comparison": false,
  "state": {
    "scope": "session",
    "persists_across_requests": true,
    "reset_between_trials": true,
    "required_handles": ["session"]
  },
  "deception": {
    "enabled": true,
    "entry_trigger_digest": "sha256:00e24681f0f7d187a77708c4d846256db4f3f9930bc8123d8d3b6220a9eed4f7",
    "isolation_scope": "session",
    "sticky_until": "trial-end",
    "real_target_reentry": true,
    "cross_session_linking": "none",
    "state_consistency_contract_digest": "sha256:00e24681f0f7d187a77708c4d846256db4f3f9930bc8123d8d3b6220a9eed4f7"
  },
  "model_use": {
    "enabled": true,
    "requested_model_id": "haiku",
    "identity_evidence_policy_digest": "sha256:6d985e2934bbabadc4245836913a61052fb552a5aa6fa102d5bda802eefe51f8",
    "prompt_digest": "sha256:6d985e2934bbabadc4245836913a61052fb552a5aa6fa102d5bda802eefe51f8",
    "parameter_digest": "sha256:a06843f173c7c588782c824ed8473f79c2d92956db17adb3d4e2a7aebb47d272"
  },
  "failure_handling": {
    "timeout_ms": 200000,
    "timeout_outcome": "invalid-defense-error",
    "error_outcome": "invalid-defense-error",
    "retry_count": 0
  }
}
